Judul,Penulis,Pembimbing 1,Pembimbing 2,abstrak,Kata Kunci,Label
SISTEM PENENTUAN STATUS GIZI PASIEN RAWAT INAP MENGGUNAKAN METODE NAÏVE BAYES CLASSIFIER (STUDI KASUS : RSUD DR. H. SLAMET MARTODIRDJO PAMEKASAN),Nur Anggraeni,"Diana Rahmawati, ST.M.T","Firli Irhamni, ST.M.Kom","Di Indonesia masalah perkembangan gizi adalah masalah yang perlu perhatian lebih. Jika seseorang tidak mengetahui tentang status gizinya, maka tidak akan dapat mengontrol berapa banyak jumlah gizi yang dibutuhkan dalam tubuh. Dalam penelitian ini dirancang aplikasi sistem pendukung keputusan yang digunakan untuk menentukan status gizi pasien dan memberikan solusi makanan pada pasien sesuai riwayat penyakit yang di derita pasien. Sistem yang dirancang ini berbasis Web, dan memudahkan pihak admin atau ahli gizi rumah sakit dalam penentuan status gizi pasien. Diharapkan dengan adanya aplikasi ini dapat memberikan efisien dan efektifitas kinerja setiap pihak. Metode yang digunakan dalam penelitian ini menggunakan Naïve Bayes Classifier (NBC). Metode terbaru yang di gunakan untuk memprediksi probabilitas.Metode Naïve bayes Classifier melakukan proses penentuan perhitungan probabilitas status gizi. Dimana dicari nilai probabilitas terbesar yang kemudian menjadi kesimpulan penentuan status gizi. Metode ini dapat diterapkan dalam studi kasus Sistem Penentuan Status Gizi Pasien dengan hasil akurasi terbesar 92%.","Naïve Bayes Classifier, Sistem Pendukung Keputusan, Status Gizi, Web",RPL
SISTEM AUGMENTED REALITY ANIMASI BENDA BERGERAK MENGGUNAKAN FLARTOOLKIT,Septian Rahman Hakim,"Arik Kurniawati, S.Kom., M.T.","Haryanto, S.T., M.T.","Seiring perkembangan teknologi yang ada didunia, muncul teknologi yang disebut augmented reality. Augmented Reality (AR) merupakan upaya untuk menggabungkan dunia maya dan dunia virtual yang dibuat melalui komputer sehingga batas antara keduanya menjadi sangat tipis. Head-Mounted Display (HMD) merupakan contoh hasil dari penelitian tentang Augmented Reality, ini merupakan satu-satunya peralatan dasar dalam teknologi-teknologi terbaru. Seiring berjalannya waktu, augmented reality berkembang pesat sehingga memungkinkan pengembangan aplikasi ini di berbagai bidang. Untuk mengembangkan AR banyak sekali library pendukung yang dapat digunakan. FlarToolKit adalah salah satunya. FlarToolKit merupakan library pendukung augmented reality pada platform flash. Berdasarkan sistem AR animasi benda bergerak yang dibuat adalah animasi bergerak permainan pingpong dimana telah dikolaborasikan dengan augmented reality untuk menggerakkan setiap langkah dari playernya. Interaksi antar obyek tersebut dapat dilihat dari gerak bola yang dapat dipukul dengan obyek virtual yang ditampilkan melalui augmented reality.",-,CAI
APLIKASI KONTROL DAN MONITORING JARINGAN KOMPUTER BERBASIS MOBILE,M. Basith Ardianto,"Drs. Budi Soesilo, MT","Koko Joni, ST","Berjalannya koneksi jaringan komputer dengan lancar dan tanpa gangguan merupakan harapan seluruh penggunanya, terutama pihak yang bertanggung jawab pada bidang itu, yakni administrator jaringan. Namun tidak selamanya koneksi jaringan dapat berjalan dengan lancar tanpa adanya gangguan. Kenyataan di lapangan terutama pada jaringan komputer skala besar, berpotensi besar terjadi gangguan atau bahkan kerusakan koneksi jaringan komputer. Hal ini rata - rata disebabkan banyaknya penggunaan serta padatnya traffic data dalam jaringan komputer itu sendiri. Oleh karena itu untuk menjaga bahkan meningkatkan kualitas layanan koneksi jaringan maka diperlukan adanya akses kontrol dan monitoring pada level administrator jaringan secara real-time berbasis mobile, yang dapat mengatur dan mengetahui informasi tentang koneksi jaringan dan dapat diakses setiap saat. Pihak administrator jaringan dituntut untuk terlebih dahulu mengetahui adanya gangguan atau bahkan terputusnya koneksi jaringan walaupun administrator tidak berada di tempat kontrol dan monitoring, Dengan adanya sistem kontrol dan monitoring berbasis mobile, diharapkan dapat membantu tugas administrator dalam mengontrol dan memantau jaringan serta dalam mengambil kebijakan atas node – node yang terkoneksi pada jaringan yakni memanajemen koneksi, port dan bandwidth setiap saat dan secara mobile. agar dengan segera dapat melakukan pembenahan ketika terjadi gangguan jaringan sebelum pemakai jaringan (klien) melakukan pengaduan atas adanya gangguan.","Algoritma Genetika, Optimasi,  Penjadwalan",RPL
RANCANG BANGUN APLIKASI PROXY SERVER UNTUK ENKRIPSI KODE HTML MENGGUNAKAN ALGORITMA BLOWFISH,"Akhmad Suyandi, S.Kom","Drs. Budi Soesilo, M.T","Hermawan, ST, MT","Web server adalah sebuah perangkat lunak server yang berfungsi menerima permintaan HTTP atau HTTPS dari web client dan mengirimkan jawaban dalam bentuk halaman-halaman web yang umumnya berbentuk dokumen HTML. Dokumen HTML yang dikirim merupakan dokumen yang dibentuk dari bahasa markup yang plaintext. Artinya, dokumen berisi kode-kode HTML murni tanpa proses enkripsi. Tujuan dari penelitan ini adalah membuat sebuah aplikasi proxy server yang menerima permintaan HTTP dari web client dan meneruskannya ke web server. Kemudian aplikasi ini akan menerima respon dari server dan melakukan proses enkripsi pada dokumen HTML terlebih dahulu. Sehingga dokumen HTML yang dikirim kepada web client sudah berbentuk dokumen HTML yang terenkripsi. Web client disini bisa berupa aplikasi seperti Internet Explorer, Mozilla Firefox, atau Opera. Aplikasi-aplikasi tersebut biasa dikenal dengan sebutan web browser. Ketika web browser menerima dokumen HTML yang terenkripsi dari aplikasi proxy server, maka JavaScript Engine yang ada di web browser akan melakukan proses dekripsi sekaligus rendering sehingga dokumen akan ditampilkan sesuai dengan aslinya. Namun apabila kode dari dokumen HTML tersebut dilihat melalui menu view source yang ada di web browser akan didapatkan dokumen HTML yang tetap terenkripsi.",-,CAI
SISTEM INFORMASI PERUSAHAAN OTOBUS SUMBER KENCONO BERBASIS  WEB,Elky Lilik Misdayani,"Fitri Damayanti,S.Kom,M.Kom",-,"Sistem informasi pengolahan data yang dibutuhkan oleh sebuah organisasi dipergunakan untuk tujuan pengumpulan, pengolahan, penyimpanan dan melihat kembali data itu sendiri. Dengan menggunakan Sistem Informasi Perusahaan Otobus  Sumber Kencono proses pencatatan yang dilakukan oleh masing – masing petugas dengan sesuai kebutuhan dapat di selesaikan dengan lebih cepat, tepat dan lengkap dengan hasil akhir yang dapat menginputkan data kerusakan bus, penginputan gaji crew, jadwal keberangkatan bus, informasi lerling crew serta tarif yang diberlakukan oleh perusahaan untuk pengguna jasa (pelanggan) untuk diproses menjadi sebuah laporan. Sistem Informasi ini dapat menangani masalah yang ada pada perusahaan dengan lebih cepat. Sistem ini akan memberikan  informasi yang cepat dan akurat kepada pegawai bengkel bus ada tidaknya bus yang perlu segera ditangani, kasir juga dengan mudah dalam menghitung gaji crew sesuai dengan pendapatan yang diperoleh serta inputan data keberangkatan bus, operasional tidak akan kerepotan dalam menentukan diterima atau tidaknya crew baru dan semua pengguna pelanggan bus dapat mengetahui tarif penumpang tanpa adanya manipulasi.""",-,RPL
IMPLEMENTASI  ALGORITMA PRIM  DAN DEPTH FIRST SEARCH PADA PEMBUATAN MAZE GAME BERBASIS ANDROID OS MOBILE,M Khoiril Anwar,"Cucun Very Angkoso, S.T., M.T.","Arik Kurniawati S. Kom., M.T.","Teknologi mobile game beroperating system open source berkembang dengan sangat pesat. Karena keragaman variasinya, mobile game memiliki banyak peminat dari berbagai kalangan. Hal inilah yang menjadi dasar bagi para pengembang untuk terus mengembangkan mobile game. Pada penelitian ini, sebuah mobile game untuk mengasah kemampuan berfikir telah dikembangkan dengan mengimplementasikan algoritma Prim dan Depth First Search. Dalam pembuatannya, algoritma Prim diterapkan pada saat pembuatan lintasan dari maze sedangkan algoritma Depth First Search diterapkan pada saat melakukan proses pencarian solusinya. Dari hasil pengujian dapat disimpulkan bahwa algoritma Prim dan Depth First Search dapat berfungsi dengan baik pada resolusi screen 320 x 480 pixels dalam pembentukan lintasan dan pencarian solusi dari maze.","Mobile Game, Android, Algoritma Prim, Algoritma Depth First Search",RPL
EKSTRAKSI FITUR BERBASIS TWO DIMENSIONAL LINEAR DISCRIMINANT ANALYSIS  UNTUK PENGENALAN WAJAH,Muhammad Choirur Rozi,"Dr. Arif Muntasa, S.Si.,M.T","Fitri Damayanti, S.Kom.,M.kom","Sistem pengenalan wajah adalah suatu sistem untuk mengenali identitas diri dari seseorang melalui wajah manusia. Teknologi ini mengidentifikasi bagian tubuh manusia yang unik dan tetap seperti wajah manusia. Hal khusus di bidang identifikasi dan pengenalan wajah manusia memanfaatkan pengolahan dan juga analisis citra wajah, yang akan berperan penting dalam proses pengenalan wajah manusia. Sistem ini dapat di manfaatkan dalam suatu sistem keamanan di bidang biometrika. Pada penelitian ini telah di bangun suatu perangkat lunak pengenalan citra wajah manusia menggunakan metode Two Dimensional Linear Discriminant Analysis (2DLDA) untuk menentukan karakteristik dari wajah manusia. Sedangkan pada tahap pengklasifikasian digunakan metode Angular Separation untuk mengukur kemiripan antara data pelatihan (training) dan data uji coba (testing). Melalui proses testing gambar wajah ini dapat di ketahui identitas diri dari seseorang. Dari uji coba aplikasi menggunakan klasifikasi Angular Separation di peroleh akurasi pengenalan benar sebesar  94.5%, pada  lima pose citra wajah pelatihan  dan lima pose citra wajah uji coba (testing) dengan jumlah data masing - masing dua ratus citra wajah manusia yang di ambil dari database ORL dengan menggunakan sepuluh eigen.","Sistem pengenalan wajah, Two Dimensional Linear Discriminant Analysis, Angular Separation",CAI
RANCANG BANGUN GAME PERAWATAN SAPI KARAPAN MENGGUNAKAN METODE FUZZY LOGIC,NURRACHMAT,"Arik Kurniawati, S.Kom., M.T.","Kurniawan Eka Permana, S.Kom., MSc.","Perkembangan game yang semakin pesat, memberikan berbagai alternative bagi peminatnya. Mulai dari bentuk game, cerita maupun media penyajian. Keberadaan game yang menggambarkan budaya Indonesia khususnya daerah kepulauan seperti Madura terhitung sedikit, sehingga dapat dirasa semakin lunturnya kebudayaan Indonesia bagi anak bangsa. Adanya peminat game yang semakin banyak dapat digunakan sebagai sarana pengenalan budaya asli Madura. Sebuah aplikasi game tentang olahraga yang sangat digemari di pulau Madura tersebut seperti Kerapan Sapi adalah sangatlah penting. Untuk itu perlu dibangun aplikasi game kerapan sapi sebagai upaya pelestarian budaya bangsa khususnya pulau Madura. Dengan upaya pembuatan game budaya maka dibangun  game perawatan sapi karapan menggunakan metode logika fuzzy (fuzzy logic), dengan menginputkan parameter kekuatan dan kesehatan sapi karapan untuk menentukan harga jual sapi karapan dalam sebuah game perawatan sapi karapan.","game, kerapan sapi, perawatan sapi kerapan, budaya madura",RPL
SISTEM PENDUKUNG KEPUTUSAN SELEKSI SISWA UNGGULAN RINTISAN SEKOLAH BERTARAF INTERNASIONAL MENGGUNAKAN METODE SAW (SIMPLE ADDITIVE WEIGHTING) (Studi Kasus SMP Negeri 1 Sumenep),Khaifah,"Yeni Kustiyahningsih,S.Kom,M.Kom",-,"Perkembangan dunia pendidikan mendorong para siswa untuk mampu bersaing. SMP Negeri 1 Sumenep merupakan satu-satunya SMP yang memiliki standar internasional (RSBI) yang ada di kabupaten Sumenep. Banyaknya siswa yang mendaftar menjadi siswa kelas RSBI ke SMP Negeri 1 Sumenep menyulitkan bagi pihak yang menyeleksi untuk menentukan siswa yang layak diterima karena penyeleksian siswa dilakukan secara manual oleh pihak sekolah. Pada penelitian ini telah dilakukan pemilihan siswa baru untuk kelas RSBI SMP Negeri 1 Sumenep dengan menggunakan Simple Additive Weighting (SAW). Konsep dasar merode SAW adalah mencari penjumlahan terbobot dari rating kinerja pada setiap alternatif pada semua atribut. Metode SAW membutuhkan proses normalisasi matriks keputusan ke suatu skala yang dapat dibandingkan dengan semua rating alternatif yang ada. Dari hasil uji coba yang telah dilakukan, tingkat kecocokan hasil perangkingan metode SAW yaitu 70%. Sehingga sisten ini dapat dijadikan bahan pertimbangan dalam menyeleksi siswa unggul.","Simple Additive Weighting (SAW), Sistem Pendukung Keputusan (SKP),  Rintisan Sekolah Bertaraf Internasional (RSBI)",CAI
PENERAPAN METODE ANALYTICAL HIERARCHY PROCESS DAN FUZZY MULTI-OBJECTIVE PROGRAMMING UNTUK PEMILIHAN SUPPLIER,Helyatin,"Bain Khusnul K, S.T.,M.Kom","Andharini Dwi C, S.Kom.,M.Kom","Pemilihan  supplier merupakan salah satu isu penting, karena  pemilihan supplier menjadi bagian dari sebuah  supply chain maka hubungan tersebut akan memiliki pengaruh yang sangat besar terhadap kelangsungan produksi.Pada tugas akhir ini dianalisa mengenai  Analytic Hierarchy Process (AHP) dan Fuzzy Multi-Objective Programming (FMOP) untuk pemilihan supplier di Industri Batik Podhek Pemekasan. Perhitungan AHP akan diperoleh nilai bobot tiap kriteria pemilihan supplier yang nantinya akan jadi nilai masukan pada FMOP. FMOP memberikan solusi memaksimalkan dan meminimalkan tujuan.Setelah dilakukan proses perhitungan faktor kriteria yang paling memberikan kontribusi terhadap pemilihan supplier adalah kriteria harga (0.52), kualitas (0.2) dan tingkat cacat (0.2), dan keterlambatan pengiriman (0.08). Dari hasil penelitian diperoleh bahwa supplier paling optimum adalah  Toko Utara. Untuk bahan baku kain dengan batasan pembelian 0 - 500 lembar didapatkan hasil z1 = 380, z2 = 415, z3 = 85, z4 = 250. Untuk bahan baku pewarna dan malan dengan batasan pembelian 0 - 250 kg didapatkan hasil z1 = 0, z2 = 220, z3 = 30, z4 = 125, dan z1 = 147.5, z2 = 225, z3 = 25, z4 = 125.","Supply Chain Management (SCM), pemilihan supplier, Analytical Hierarchy Process, Fuzzy, Multi-Objective Programming",RPL
USULAN PERBAIKAN PADA PROSES PRODUKSI BOTOL KACA DNGAN MENGGUNAKAN METODE LEAN SIX SIGMA (Studi Kasus : di PT. IGLAS Gresik),NINA ARIS RIANA,"M. IMRON MUSTAJIB., S.T., M.T","ARI BASUKI., S.T., M.T","Penelitian ini membahas tentang penggunaan metode  lean six sigma  pada proses produksi botol PANJI 275 ml di PT. IGLAS. Selama proses produksi ditemukan pemborosan-pemborosan yang terjadi.  Pemborosan yang terjadi antara lain,  lead time  proses produksi yang terlalu lama,  dan terjadinya  defect  yang tinggi.  Tujuan dari penelitian ini  yaitu mengetahui penyebab  terjadinya  waste. Setelah diketahui penyebab-penyebab terjadinya  waste, maka selanjutnya dilakukan usulan perbaikan untuk mengurangi terjadinya  waste.  Dari hasil penelitian yang dilakukan, maka didapat nilai sigma sebesar 2,3703 untuk periode I dan 2,2786 untuk periode II. Sedangkan dengan usulan pada aktivitas proses produksi yaitu dengan menggabungkan aktivitas sortir dengan pendinginan (annealing) maka, dapat mengurangi waktu  lead time  periode I dari 215,45 jam menjadi 170,30 jam atau selisih sebesar 41,15 jam, dan untuk periode II yaitu 261,82 jam menjadi 201,70 jam atau selisih 60,12 jam.","lean six sigma, big picture mapping, proses produksi",CAI
SISTEM INFORMASI PENGELOLAAN STUDIO MUSIK BERBASIS WEB,R. Septian Dwianto Haryansah,"Firli Irhamni. S.T.,M.Kom",-,"Master studio musik adalah suatu bidang jasa yang bergerak di bidang Persewaan studio musik yang cukup berkembang. Selama ini masih menggunakan sistem manual dalam mencatat setiap transaksi yang terjadi. Oleh sebab itu tentunya akan mengakibatkan terjadinya banyak kesalahan dalam pencatatan transaksi, dan tidak adanya laporan pencatatan sewa sehingga sistem pencatatan ini bisa dikatakan masih belum efektif dan perlu dibuat suatu sistem yang dapat dikatakan secara jelas memperlihatkan keuntungan  dalam jangka waktu tertentu. Oleh karena itu dengan adanya Studio Musik ini berharap agar dapat meningkatkan kualitas sewa Studio Musik melalui web. Sistem Informasi Pengelolaan Studio Musik Berbasis Web akan membantu pelanggan untuk memesan studio musik secara online. Pelanggan tidak perlu datang langsung ke studio untuk melakukan pemesanan. Cukup membuka alamat web pelanggan sudah bisa memesan studio dan berlatih musik dan berharap dapat meningkatkan kualitas persewaan studio musik melalui web untuk mempermudah dan memuaskan pelanggan dengan harapan agar dapat memperluas jangkauan pasar dan dapat mempermudah pelanggan dalam proses studio musik.","Master Studio Musik, Pemesanan Studio dan Sewa Alat Sound Sistem Berbasis Web",RPL
Sistem Informasi Program Imunisasi (Studi kasus di Posyandu Karang Panasan Blega Kab. Bangkalan),Usayri,Wahyudi Setiawan S.KOM. M. KOM,-,"Imunisasi adalah pemberian kekebalan tubuh terhadap suatu penyakit dengan memasukkan sesuatu kedalam tubuh agar tubuh tahan terhadap penyakit yang sedang mewabah atau berbahaya bagi seseorang. Imunisasi berasal dari kata imun yang berarti kebal atau resisten. Pembangunan kesehatan pada hakekatnya adalah penyelenggaraan upaya kesehatan bagi setiap penduduk agar dapat terwujudkan kesehatan masyarakat yang optimal. Salah satu upaya untuk mencapai keadaan tersebut adalah dengan menurunkan angka kesakitan dan kematian bayi dan balita. Program imunisasi merupakan salah satu kegiatan yang mendapat prioritas dalam sistem kesehatan nasional. Program ini bertujuan untuk melindungi bayi dan balita dari PD3I (penyakit yang dapat di cegah dengan imunisasi) seperti TBC, difteri, pertusis, tetanus dan campak. Pada Tugas Akhir ini dibuat sistem informasi imunisasi ibu dan balita di posyandu Karang Panasan Blega Bangkalan. Sistem informasi Imunisasi ini terdiri dari imunisasi anak dan ibu dimana imunisasi anak terdiri dari imunisasi Hepatitis B, BCG, Polio, DPT, dan Campak sedangkan imunisasi ibu terdiri dari imunisasi TT I dan TT II, dengan adanya program ini masyarakat sekitar sangat terbantu dalam masalah kesehatan di desa tersebut.","sistem informasi, Posyandu, Imunisasi",RPL
SISTEM INFORMASI AKADEMIK SMK ALBAISUNY KOKOP BERBASIS WEB,kholid,Wahyudi Setiawan S.KOM. M. KOM,-,"Sistem Informasi Akademik merupakan suatu sistem yang meberikan layanan informasi yang berupa data akademik. Keberadaan sistem informasi ini penting. Dalam hal ini, SMK AL- BAISUNY KOKOP dijadikan sebagai tempat penelitian, karena sistem informasi akademik yang ada di sekolah tersebut belum terkelola dengan baik sehingga seringkali mempersulit dalam pelaksanaan aktifitas-aktifitas akademik yang ada, 1 seperti proses pengolahan data siswa, pengolahan data guru, pengolahan nilai siswa, pengolahan absen siswa, dan pengolahan data anggota ekstrakurikuler. Tujuan Tugas akhir ini adalah untuk memberikan kemudahan pada saat proses pengolahan data siswa dan guru, mempermudah dalam pengolahan nilai siswa, meminimalisir kesalahan dalam pencatatan data siswa, dan meningkatkan keamanan data siswa sehingga keamanan data siswa lebih terjamin. Dan dari tujuan penelitian tersebut dihasilkan beberapa kegunaan yang terdiri dari kegunaan praktis dan akademis.","Sistem informasi, SMK Al-Baisuny, Siswa, Pelajar",RPL
ANALISA DATA ANTARAN POS EXPRESS MENGGUNAKAN METODE RADIAL BASIS FUNCTION NEURAL NETWORK (RBF-NN) STUDY PT. POS INDONESIA SURABAYA,Siti Murtasiyah Warda,"Bain Khusnul Khotimah.,S.T.,M.Kom","Firli Irhamni, S.T., M.Kom.","PT. Pos Indonesia (Persero) merupakan salah satu perusahaan yang bergerak di bidang komunikasi. Saat ini, salah produk pelayanan PT. Pos Indonesia (Persero) adalah produk Pos Express.  Produk  Pos  Express ini diharapkan dapat diminati masyarakat dan dapat tetap bertahan bahkan  semakin menunjukkan keunggulan PT. Pos Indonesia (Persero). Untuk  itu perlu dilakukan  analisis untuk melihat pola perkembangan, kemajuan  yang telah ditunjukkan, bahkan untuk melihat dan memperoleh informasi, berupa peramalan  dalam waktu ke depan terhadap produk Pos Express yang masuk  ke kantor Mail  Processing Center  (MPC) Surabaya. Dalam  hal  ini analisis yang dilakukan adalah peramalan jumlah produk Pos Express dengan menggunakan Metode RBF-NN (Radial Basic function neural  network).  Hasil  analisa  pada  ujicoba  yang  dilakukan  menghasilkan  nilai  yang cukup optimal, salah satunya pada percobaan 2 inputan dengan hasil peramalan pada epoch ke-60  yang memperoleh hasil MSE : 0.124497 dan MAPE : 15.058923 dengan hasil ramal yang berjumlah 2587.9966.","Peramalan , Jaringan Syaraf Tiruan (JST), Radial Basis Function neural network (RBF-NN)",RPL
Deteksi Manusia Menggunakan Histogram of Oriented Gradients dan Naïve Bayes Classifier,R.A. Uluwiyah Nur Oktavianis,"Dr. Indah Agustien, S.Kom., M.Kom","Ari Kusumaningsih, S.T, M.T","Deteksi manusia merupakan  suatu aplikasi yang berfungsi untuk mendeteksi objek manusia dalam sebuah citra. Beberapa keuntungan yang dapat diambil dari kajian ini, yaitu penerapan pada video pengawasan. Namun, dalam video pengawasan manusia yang dideteksi dalam keadaan bergerak. Sedangkan aplikasi ini, hanya mendeteksi atau menemukan objek manusia dari background sebuah citra. Sehingga dalam proses pembuatan aplikasi ini diperlukan perhitungan – perhitungan khusus untuk mendapatkan hasil yang baik. Penelitian ini menggunakan dua tahap yaitu proses ekstraksi fitur dan klasifikasi. Proses ekstraksi fitur menggunakan metode Histogram Of Oriented Gradients (HOG). Pada prinsipnya HOG menggunakan histogram untuk memperoleh ekstraksi fitur tersebut, dengan  beberapa langkah diantarnya yaitu konversi citra, gradient compute dan normalisasi. Sedangkan pada metode Naive Bayes Classifier ini di gunakan untuk proses pengklasifikasian atau pencocokan citra. Sehingga pada hasil akhir dapat diketahui kelas citra yang telah diuji. Berdasarkan uji coba aplikasi menggunakan perhitungan distribusi gaussian probabilitas pada naive bayes classfier dengan nilai threshold = 12,13,14 dan 15 pada skenario 1, 2 dan 3 diperoleh rata – rata akurasi sebesar 68,65%.","Histogram Of Oriented Gradient, Naive Bayes Classifier",RPL
SISTEM PERAMALAN KEBUTUHAN OBAT MENGGUNAKAN METODE JARINGAN SYARAF TIRUAN ALGORITMA  BACKPROPAGATION DENGAN FUNGSI LYAPUNOV,Rahmatina Hidayati,"Bain Khusnul Khotimah, S.T.,M.Kom.","Haryanto, S.T.,M.T.","Obat merupakan salah satu kebutuhan penting dalam rumah sakit. Selama ini, kebutuhan pengumpulan data obat adalah masalah yang sering dihadapi oleh Farmasi yang memiliki kewenangan dalam pengadaan obat-obatan di rumah sakit Dr H. Slamet Martodirdjo Pamekasan. Dalam rangka menjamin ketersediaan obat perlu untuk mengatasi kebutuhan obat sesuai dengan jumlah yang dibutuhkan. Dalam rangka memenuhi tingkat kebutuhan untuk obat perlu untuk meramalkan masa depan pasokan obat dengan menggunakan data sebelumnya sebagai data untuk menentukan nilai kesalahan pelatihan metode yang digunakan. Dalam penelitian ini, metode yang akan digunakan untuk memprediksi kebutuhan obat adalah Jaringan Syaraf menggunakan algoritma Backpropagation dengan penambahan fungsi Lyapunov. Dengan penambahan fungsi ini, mampu memecahkan masalah yang terjadi dalam Backpropagation standar sering lambat untuk mencapai konvergensi. Dari uji coba yang dilakukan dengan 3 Skenario didapatkan hasil parameter terbaik untuk melakukan peramalan pada nama obat Ambroxol dengan  nilai (?) sebesar 13, learning rate 0.4 dan epoch=125 memperoleh  nilai MAPE  2.7% .  Obat Bisoprolol Tab 5mg dengan nilai (?) sebesar 2,  learning rater  0.5 dan epoch 150 memperoleh nilai MAPE  2,94089%.  Obat Cefixime Caps 100mg dengan  nilai (?) sebesar 4, learning rate   0.2  dan epoch 100  memperoleh nilai MAPE  1,10466%.",-,RPL
Pengenalan Tulisan Tangan Carakan Jawa Secara Real Time  Dengan Menggunakan Dominant Point,Nining Latifah,"Fitri Damayanti, S.Kom., M.Kom","Rima Tri Wahyuningrum, ST, MT","Pengenalan tulisan tangan adalah salah satu cabang dari pengenalan pola. Carakan merupakan tulisan yang cukup kompleks dan memiliki karakteristik yang lebih unik dibandingkan dengan tulisan latin, apalagi bila ditulis dengan tulisan tangan. Faktor yang menyebabkan proses pengenalan tulisan carakan sulit untuk dilakukan adalah variasi bentuk tulisan carakan dan memiliki kemiripan antar huruf. Hal ini memungkinkan adanya kesalahan dalam proses klasifikasi. Pada penelitian ini dibangun sistem pengenalan tulisan tangan secara real time dimana proses ekstraksi ciri menggunakan metode Dominant Point untuk mendapatkan ciri pada setiap karakter masukan. Metode ini pada dasarnya sistem akan membaca arah goresan pena yang didasarkan pada kumpulan titik. Pada proses klasifikasi serta pengenalan karakter menggunakan Fine Classification. Pada proses ini, pengenalan dilakukan dengan tiga tahap yaitu penilaian prakandidat, menyeleksi kandidat, lalu pencocokan karakter. Proses ini yang membuat sistem dengan cepat melakukan proses pengenalan. Dari uji coba yang dilakukan pada sistem, hasil terbaik untuk pengenalan citra huruf tulisan tangan carakan diperoleh dari data pelatihan sebanyak 600 citra pada data uji coba skenario ke 3 dengan akurasi sebesar 90%. Sedangkan hasil terendah diperoleh dari data pelatihan sebanyak 200 citra pada data uji coba skenario ke 1 dengan akurasi sebesar 40%. Hasil akurasi rata-rata dari sembilan skenario adalah sebesar 67,67%.","Handwriting Recognition, Carakan, Dominant Point,  Fine Classification",CAI
