Judul,Penulis,Pembimbing 1,Pembimbing 2,abstrak,Kata Kunci,Label
SISTEM PEROLEHAN CITRA BERBASIS ISI MENGGUNAKAN WAVELET HAAR DAN EUCLIDEAN DISTANCE,VEMBRI PRATAMA PRISTYONO,"BAIN KHUSNUL KHOTIMAH, S.T., M.Kom.","ABDULLAH BASUKI RAHMAT, S.Si., M.T.","Batik merupakan seni yang paling penting dalam kehidupan masyarakat Indonesia. Keanekaragaman batik berasal dari beberapa wilayah diseluruh indonesia sehingga menyimbolkan karakteristik ciri pola batik yang berbeda-beda dari masing-masing daerah tempat batik tumbuh dan berkembang. Tugas Akhir ini telah berhasil membuat suatu Sistem Perolehan Citra berbasis Isi (SPCI) dengan ciri tekstur yang bertujuan untuk mengetahui ciri dari pola batik tersebut. SPCI merupakan metode atau teknik pencarian gambar citra yang mirip (similar) dengan melakukan perbandingan antara citra query dengan citra yang ada dalam basis data. Pada Penelitian  ini menggunakan ciri tekstur sebagai proses pencarian kemiripan dari delapan wilayah citra batik yang  berbeda yaitu: Cirebon, Bali, Bangkalan, Pamekasan, Sumenep, Yogyakarta, Solo, dan Pekalongan sebagai obyek perolehan citra berbasis isi. Metode yang digunakan pada penelitian ini berbasis tekstur kasar atau lembut yaitu metode Wavelet Haar. Wavelet Haar merupakan metode dimana pada setiap citra didekomposisi menjadi 4 bagian yaitu LL, LH, HL, dan HH. Pada masing-masing bagian tersebut ditentukan nilainya. Sehingga dari hasil ekstraksi fitur akan dilakukan pengukuran kemiripan dengan citra basis data dengan menggunakan metode Euclidean Distance. Citra query dan citra basis data yang dipergunakan sebanyak 200 citra dengan delapan kelas citra didalamnya. Citra tertinggi dari hasil uji coba skenario-skenario pada penelitian ini dapat diambil kesimpulan bahwa akurasi tertinggi ada pada kelas bangkalan, cirebon, pamekasan dan solo. Jumlah citra yang dihasilkan dari perhitungan akurasi adalah 8 citra yang mirip dari 10 citra terbaik yang ditampilkan berdasarkan fitur citra Roughness, yaitu fitur untuk mengetahui apakah sebuah tekstur tersebut kasar atau lembut. Dengan hasil nilai akurasi tertinggi sebesar 80 %.""",-,CAI
RANCANG BANGUN SISTEM INFORMASI PEMETAAN TANAMAN PERTANIAN DI KABUPATEN BANGKALAN,RIDHA MARISTA,"HUSNI,S.Kom., M.T.","DIANA RAHMAWATI, S.T., M.T.","Kabupaten Bangkalan memiliki lahan pertanian seluas kurang lebih 98.683,38 Ha atau sekitar 79,03 % dari luas kabupaten Bangkalan seluruhnya. Lahan tersebut terdiri atas sawah teknis seluas 1.956,49 Ha tegal seluas 71.751,98 Ha, lahan kering mencapai 77.999,63 Ha yang tersebar di setiap kecamatan dengan topografi datar hingga berbukit. Namun demikian pembangunan pertanian mengalami hambatan karena selain kesuburan tanah rendah sebagian besar pembangunan pertanian masih tradisional  tanpa memerhatikan aspek kesesuaian lahan dan tanaman. Dalam tugas akhir ini dikembangkan sistem informasi pemetaan tanaman pertanian di kabupaten Bangkalan berbasis lahan. Penentuan jenis tanaman pada sistem berpedoman  pada hasil analisa kriteria kesesuaian jenis lahan dan jenis  tanaman dengan menggunakan metode matching dari Dinas Pertanian dan Peternakan Balai Penyuluhan Pertanian (BPP)  kabupaten Bangkalan. Data yang diperoleh diolah menjadi data spasial atau peta lokasi tanaman dengan memanfaatkan Google Maps sebagai aplikasi pemetaannya. Aplikasi Google Maps dipilih karena lebih memudahkan dalam mengetahui dan menentukan lokasi secara lebih detail. Penerapan aplikasi sistem informasi ini dapat membantu  pengguna khususnya petani dalam perencanaan dan pemilihan jenis tanaman yang sesuai untuk dikembangkan pada setiap kecamatan sehingga dapat meningkatkan produktivitas, kuantitas dan kualitas pertanian di kabupaten Bangkalan. ","Kabupaten Bangkalan, Sistem Informasi, Google Maps, Lahan dan Tanaman",RPL
sistem pakar penentuan jenis narkoba bedasarkan gejala fisik yang tampak menggunakan metode forward chaining berbasis web,Rio Ferry Hermawan,"Fitri Damayanti , s.kom, M.kom",-,"Narkotika merupakan zat yang sangat berbahaya bagi manusia, dan orang yang terkait kasus narkotika juga akan mendapatkan hukuman sesuai dengan UU No.22 Tahun 1997. Masalah hukum tindak pidana narkotika dalam UU tersebut cukup kompleks sehingga sulit bagi orang awam untuk mengerti dan memilah pasal-pasal yang mengatur kasus hukum. Sehingga perlu ada sebuah aplikasi sistem pakar untuk membantu memahami dan memilah pasal-pasal yang terlibat dalam kasus hukum. Pengembangan sistem pakar ini mengunakan metode  forward chaining, yaitu proses memulai pencarian dari premis atau data menuju pada kesimpulan. Metodologi yang digunakan dalam penelitian ini adalah metode forward chaining.bahasa pemrograman yang  digunakan PHP, basis data Mysql dan menggunakan Macromedia Dreamweaver. Tujuan dari sistem pakar ini adalah untuk menentukan jenis narkoba dari hasil gejala-gejala yang di timbulkan oleh narkoba.","narkotika, sistem pakar, forward chaining",RPL
ANALISIS DAN PENERAPAN ALGORITMA PARTICLE SWARM OPTIMIZATION PADA OPTIMASI PENJADWALAN MATA KULIAH DI JURUSAN TEKNIK INFORMATIKA UNIVERSITAS TRUNOJOYO MADURA,Qomarul Haryadi Irfan Rifa'i,"Bain Khusnul Hotimah S.T., M.Kom.","Arik Kurniawati, S.Kom, M.T.","Penjadwalan mata kuliah di program studi Teknik Informatika Universitas Trunojoyo Madura dilakukan pada setiap pergantian semester. Beberapa faktor yang mendukung penjadwalan mata kuliah antara lain dosen, mahasiswa, mata kuliah, serta jumlah ruang dan waktu yang tersedia. Permasalahan optimasi penjadwalan merupakan masalah yang sudah umum dan telah dipelajari dalam waktu yang lama, namun perlu dicari metodologi atau pendekatan teknis dan sampai saat ini telah berkembang beberapa solusi alternatif yang ditawarkan. Dalam penelitian ini digunakan algoritma Particle Swarm Optimized (PSO) utnuk melakukan optimasi pada jadwal kuliah. Karena algoritma PSO memiliki tool-tool yang cukup handal dengan penggunaan yang cukup mudah. Hasil penelitian menunjukkan bahwa algoritma Particle Swarm Optimiztion dapat diterapkan  dengan lebih baik pada optimasi penjadwalan mata kuliah dengan memaksimalkan penggunaan parameter-parameter dari algoritma Particle Swarm Optimiztion yaitu apabila nilai w besar maka untuk mengoptimalkan nilai velocity gunakan nilai kecil pada c1 dan c2, begitu juga sebaliknya bila nilai w kecil maka gunakan nilai besar pada c1 dan c2.""",-,CAI
AUTO LEVELING BERBASIS FINITE STATE MACHINE (FSM) PADA GAME PEMBELAJARAN BAHASA INGGRIS,Syafrial Nur Maulana,"Arik Kurniawati, S.Kom.,M.T.","Ari Kusumaningsih, S.T., M.T.","Pengetahuan tentang bahasa Inggris pada jaman globalisasi saat ini sangatlah penting dan menjadi salah satu sarana untuk berkompetisi di segala bidang. Namun demikian, seringkali proses pembelajaran tidak dapat berjalan dengan lancar dikarenakan kurangnya metode pembelajaran yang kurang interaktif. Berangkat dari permasalahan tersebut maka dibangunlah sebuah game yang berunsur edukasi. Game berunsur edukasi harusnya menyenangkan dan tidak terlalu mudah atau terlalu sulit dimainkan  salah satunya dengan penerapan Artifical Intelegent (kecerdasan buatan). Dalam penelitian ini adalah bagaimana pemain mendapatkan tantangan (soal) sesuai dengan kemampuannya (pelevelan mandiri/auto leveling). Sehingga pemain tidak merasa frustasi (jika soalnya terlalu sulit) atau bosan (jika soalnya terlalu mudah). Metode yang dapat digunakan untuk membuat game yang mempunyai pelevelan mandiri adalah metode Finite State Machine (FSM) dan seluruhnya akan diimplementasikan kedalam game engine XNA. Dalam game pembelajaran bahasa Inggris ini terdapat speaking dan reading yang akan memanfaatkan teknologi speech recognition yang terdapat didalam XNA game studio. Dengan melakukan uji coba sistem kepada responden menghasilkan beberapa hal menjadikan game sebagai salah satu media pembelajaran, terciptanya game yang menarik dan menjadi game yang adaptif dengan penerapan perlevelan mandiri. Penggunaan speech recognition dapat meningkatkan kemampuan berbicara dalam bahasa Inggris. ","Education Game, Automatic Leveling, FSM (Finite State Machine), XNA game engine, Speech Recognition",RPL
Rancang Bangun Sistem Pendukung Keputusan Penentuan Pemberian Bantuan RASKIN Menggunakan Metode SMARTER (Studi Kasus : Kecamatan Batuan Kabupaten Sumenep),Ayu Winda Istara,"Andharini Dwi Cahyani, S.Kom, M.Kom","Fika Hastarita Rachman, ST, M.Eng","Seiring dengan perubahan dalam paradigma pembangunan ekonomi yang tidak berfokus dalam penanggulangan masalah kemiskinan, maka sudah sepantasnya apabila pemerintah dituntut untuk dapat mengentaskan masalah kemiskinan melalui program-program pengentasan kemiskinan. Salah satu dari banyak program pengentasan kemiskinan yang dilaksanakan oleh pemerintah yaitu program RASKIN. Metode yang dipakai dalam penelitian ini adalah SMARTER (Simple Multi Attribute Rating Technique Exploiting Ranks). Metode SMARTER merupakan bagian dari metode Multiple Criteria Decision Making (MCDM). Metode ini dipilih karena metode SMARTER merupakan suatu bentuk model pendukung keputusan yang digunakan dalam pengambilan keputusan dengan kriteria yang beragam yang nantinya dapat digunakan untuk memecahkan masalah pengambilan keputusan. Penelitian yang dilakukan di Kecamatan Batuan, Kabupaten Sumenep ini menggunakan parameter kemiskinan yaitu sumber air minum, berapa kali makan per hari, kemampuan membeli daging, Ayam, susu per minggu, bahan bakar masak, jumlah pakaian baru, sumber penerangan, aset minimal, lapangan pekerjaan, tempat buang air besar, jenis lantai rumah, jenis dinding rumah, luas lantai rumah, kemampuan berobat jika sakit dan ijazah terakhir.  Pada penelitian ini, sistem pendukung keputusan menggunakan metode SMARTER mampu menganalisa kriteria yang nantinya dapat menentukan penduduk mana yang layak menerima bantuan RASKIN. Sistem ini memiliki tingkat akurasi 80,5% jika dibandingkan dengan data rill pada tahun 2012.","RASKIN, Sistem Pendukung Keputusan. SMARTER",CAI
RANCANG BANGUN APLIKASI SEARCH ENGINE DAN SISTEM PENDETEKSI PLAGIARISME MENGGUNAKAN METODE LSA-SOM,ARIS PRAMA AULIA,"Hermawan, ST., M.Kom","Dr. Indah Agustien S, S.Kom, M.Kom.","Plagiarisme adalah mencuri gagasan, kata-kata, kalimat atau hasil penelitian orang lain dan menyajikannya seolah-olah sebagai karya sendiri. Metode LSA merupakan salah satu metode dari beberapa metode untuk pendeteksian plagiarisme. Metode Latent Semantic Analysis (LSA) adalah sebuah teori dan metode untuk menggali dan mempresentasikan konteks yang digunakan sebagai sebuah arti kata dengan memanfaatkan komputasi statistik untuk sejumlah corpus yang besar. Penggunaan LSA konvensional bersifat sekuensial dikarenakan masih belum adanya klasterisasi sehingga proses analisa akan dilakukan secara global pada keseluruhan dokumen yang tentunya memerlukan waktu komputasi yang besar. Untuk itu dapat digunakan teknik klasifikasi tak terawasi seperti penggunaan Self Organizing Map (SOM) dan pengujian similaritas secara global hanya dilakukan pada centroid masing-masing kluster untuk kemudian dilakukan pengujian similaritas secara lokal pada klaster yang terpilih yang menjadi bagian dari klaster tersebut. Pada hasil penelitian  LSA-SOM memiliki rata-rata precision 94.4% dan recall 64.04%. ","Cosine Similarity, Latent Semantic Analysis, plagiarisme Self Organizing Map, Singular Value Decomposition",RPL
PENGEMBANGAN VIRTUAL CLASS UNTUK PEMBELAJARAN INTERAKTIF MATA PELAJARAN MATEMATIKA SISWA SMP BERBASIS SECOND LIFE,Dwi Adi Permana,"Arik Kurniawati,S.Kom, M.Kom","Dr. Indah Aguestien S, S.Kom, M.Kom.","Internet berkembang dengan cepat beberapa tahun belakangan ini. Banyak hal yang dapat dilakukan dengan internet dari bergabung dengan situs jejaring sosial, bermain games online, belanja melalui shop online, download dan browsing info-info yang dibutuhkan. Bukan hanya itu dunia pendidikan juga ikut meramaikan dunia internet, seperti pembelajaran jarak jauh, virtual class, games pendidikan dan lain-lain. Dalam tugas akhir ini membangun aplikasi virtual class matematika untuk siswa SMP berbasis second life. Tujuan utama dari tugas akhir ini adalah untuk membuat suatu media pembelajaran dengan menerapkan teknologi yang ada yaitu, mata pelajaran yang virtual class matematika berbasis second life. Virtual Class ini dibuat secara online dengan menggunakan Second Life. Aplikasi virtual class ini terbagi dari 6 bab materi mata pelajaran matematika, khususnya untuk siswa SMP kelas VII. Didalam virtual class ini terdapat soal evaluasi untuk setiap babnya.Jika nilai evaluasi kurang dari KKM (Kriteria Kelulusan Minimal) maka siswa wajib melakukan pendalaman materi dan evaluasi ulang. Disini KKM nya menggunakan KKM mata pelajaran matematika untuk siswa VII SMP Negeri 1 Tulangan, yaitu dengan Nilai 75. Kendala dari uji coba aplikasi ini adalah kurangnya koneksi internet yang kuat, karena Aplikasi bersifat online dan memperlukan konekasi internet yang lumayan tinggi","Internet, Virtual Class, Second Life, matematika",CAI
PROGRAM KENAIKAN PANGKAT PEGAWAI BALAI BESAR PELAKKSANAAN JALAN NASIONAL V SURABAYA BERBASIS DESKTOP,FIRMAN SURYADI,"Achmad Ubaidillah, MS, S.T.,MT",-,"Kondisi administrasi sekarang sangat kurang maksimal dalam mencari kenaikan pangkat pegawai di BBPJN V ( Balai Besar Pelaksanaan Jalan Nasional V Surabaya ) dikarenakan sistem yang ada masih berupa data. Mengingat tenaga yang harus dikeluarkan dalam mencari informasi tentang kepegawaian ini terlalu lama untuk diketahui dan terbatasnya waktu pencarian, merupakan kendala yang harus dibuat solusinya. Hal tersebut yang menjadi latar belakang untuk merancang dan membuat Program Kenaikan Pangkat di Balai Besar Pelaksanaan Jalan Nasional V Surabaya. Program ini dibuat untuk menaikkan pangkat pegawai sesuai dengan syarat dan ketentuan yang diimplementasikan ke dalam program kenaikan pangkat ini. Hasil yang diharapkan dari pembuatan Program Kenaikan Pangkat di Balai Besar Pelaksanaan Jalan Nasional V Surabaya ini, dapat mempermudah dalam menentukan layak tidaknya seorang pegawai dinaikkan pangkatnya.","BBPJN V, Kenaikan Pangkat, Kepegawaian",RPL
IMPLEMENTASI PERFORMANCE PRISM UNTUK SISTEM PENGUKURAN KINERJA PERUSAHAAN,Luhur Priyantoko Aji,"BAIN KHUSNUL KHOTIMAH, S.T., M.Kom.","Khamdi Mubarok, S.T., M.Eng.","Pengukuran kinerja adalah proses di mana organisasi menetapkan parameter hasil untuk dicapai oleh program, investasi, dan akusisi yang dilakukan. Dalam pengukuran kinerja perusahaan diperlukan indikator yang jelas sehingga bisa diketahui peningkatan atau penurunan indeks produktivitas yang menjadi tolak ukur perusahaan dalam mengukur kinerjanya. Pengukuran kinerja salah satunya diterapkan pada PT. Preshion Engineering Plastec Surabaya supaya  tetap  dapat menguasai  pasar  dan  mempertahankan  pelanggannya. Dengan menggunakan Performance Prism, metode ini mempertimbangkan semua kebutuhan dan keinginan dari semua stakeholder yang nantinya akan dijadikan dasar untuk menyusun Key Performance Indicators (KPI) kemudian KPI tersebut dibobotkan dengan ANP selanjutnya dilakukan scoring dengan Objective Matrix (OMAX) untuk mengetahui indeks produktivitas dari kinerja perusahaan. Hasil dari penelitian ini adalah dalam mengevaluasi kinerja PT Preshion Engineering Plastec Surabaya didapatkan 6 stakeholder dengan 19 subkriteria atau KPI. Dari 19 KPI tersebut, KPI Profit Growth  mendapatkan bobot normal paling tinggi yaitu 0,05307 dan KPI jumlah rapat bobotnya paling rendah yaitu 0,05262. Indeks produktivitas perusahaan pada tahun 2010 mengalami penurunan sebesar 0,29642 dari tahun 2009. Ini diakibatkan sebanyak 15 KPI pencapaiannya dibawah target. Namun untuk tahun 2011 indeks produktivitas perusahaan mengalami kenaikan dari tahun 2010 sebesar 0,420018.""",-,CAI
IMPLEMENTASI  METODE N-GRAM PADA PEMBUATAN GAME FIGHTING MADURA BERBASIS ANDROID OS MOBILE,Farizal Arifin,"Arik Kurniawati S.Kom., M.T","Cucun Very Angkoso, S.T., M.T",Teknologi mobile  game  berkembang  dengan  sangat  pesat. mobile  game memiliki  banyak  peminat  dari berbagai kalangan karena keragaman variasinya. Hal inilah yang menjadi dasar bagi para pengembang untuk terus  mengembangkan mobile  game. Pada  penelitian  ini  dibuat sebuah Game  Fighting dengan  platform Android. Game  Fighting adalah  salah  satu  genre  video  game  dimana  seorang  player  mengontrol  seorang karakter di layar permainan dan  melakukan pertarungan jarak dekat (close combat) dengan  seorang lawan. Game  fighting  dibuat  dengan  mengimplementasikan  Metode  N-gram.  Metode  N-gram  diterapkan  pada pembuatan  pergerakan  NPC  (Non  Playable  Character)  dalam  bertarung. NPC  dapat  memprediksi  gerakan lawan  selanjutnya  dengan  menggunakan  metode  N-gram.  Dari  30  gerakan  pertama  player  NPC  dapat memprediksi 9 gerakan dengan tepat. Prediksi akan menjadi semakin akurat dengan semakin banyaknya key yang tercipta. 6 dari 9 prediksi gerakan yang tepat terjadi antara pada gerakan ke-20 sampai gerakan ke-30. Metode ini akan cenderung membuat NPC bertahan jika player bergerak agresif menyerang. Hasil pengujian Game  Fighting  dapat  berjalan  dengan  baik  pada  emulator  dan  smartphone  android  yang  memiliki  resolusi screen 320 x 480 pixels. Aplikasi game ini masih dapat berjalan lancar pada tipe smartphone Android yang memiliki  resolusi  screen  lebih  besar  atau  lebih  kecil  dari 320  x  480  pixels  akan  tetapi  tampilannya  tidak sempurna. ,-,CAI
SISTEM INFORMASI PENDATAAN PERKARA PADA KEJAKSAAN NEGERI SUMENEP BERBASIS WEB,Farida Meta Joule Setyawati,"Meidya Koeshardianto, S.Si., M.T.",-,"Kejaksaan Negeri Sumenep merupakan salah satu lembaga Pemerintahan yang bekerja dalam bidang hukum. Sebagai sebuah lembaga pemerintahan di tingkat kabupaten yang menangani kasus kriminal, Kejaksaan Negeri Sumenep membutuhkan sebuah pendataan untuk tiap berkas perkara yang terjadi. Dalam proses penanganan kasus tentunya terdapat surat perintah yang digunakan untuk meneruskan pendistribusian kasus tersebut kepada pihak yang telah ditunjuk oleh Kepala Kejaksaan Negeri Sumenep. Pada penelitian ini diangkat sebuah masalah dimana terdapat sebuah sistem yang mampu mendata tiap berkas perkara yang dikemas dalam bentuk halaman web menggunakan bahasa pemrograman PHP dan MySQL yang mampu memberikan pendistribusian kasus secara otomatis menggunakan query. Untuk Data yang akan ditampilkan disini, diproses melalui sebuah surat perintah Kepala Kejaksaan Negeri Sumenep untuk menunjuk jaksa yang akan menangani tiap kasus yang terjadi. Adapun verifikasi berkas perkara akan ditampilkan dalam bentuk laporan.","Pendataan Perkara, Database, PHP",CAI
Visualisasi Proses Terjadinya Hujan Berbasis Second Life,Anggit Pratama,"Arik Kurniawati,S.Kom, M.Kom.","Dr.Indah Agustien Siradjuddin, S.Kom, M.Kom.",Perkembangan teknologi masa kini telah memungkinkan manusia untuk merasakan suatu pengalaman yang nyata tanpa perlu adanya dunia luar atau materi. Teknologi ini sering disebut teknologi virtual reality. Teknologi virtual reality dapat diterapkan di berbagai bidang salah satunya adalah didalam dunia pembelajaran. Didalam penelitian ini akan membuat suatu pembelajaran mengenai proses terjadinya hujan yang dikemas didalam simulasi virtual reality. Tujuan utama dari pengembangan virtual reality adalah untuk menirukan alam nyata ke dalam dunia maya semakin membuat kedekatan imitasi animasi realitas ke dalam dunia maya. Kehadiran teknologi virtual reality ini dimanfaatkan semaksimal mungkin dalam kehidupan sehari-hari. Didalam Penelitian ini ditetapkan perilaku yang menjadi objek adalah kegiatan proses terjadinya hujan. Kegunaan Second Life sebagai platform untuk menghidupkan konsep dalam pembelajaran proses terjadinya hujan menjadi 3 dimensi karena Second Life sangat memadai untuk memvisualisasikan sebuah bentuk 3D dan Second Life merupakan Platform yang sangat mendukung untuk membuat suatu pembelajaran. Hasil uji coba visualisasi terhadap responden mendapatkan suatu pembelajaran visualisasi proses hujan dengan cara yang berbeda dan menarik dan mudah dimengerti. ,"Virtual Reality (VR), Multimedia Proses Hujan, Second Life",CAI
Analisis Pengendalian dan Perbaikan Kualitas dengan Pendekatan Metode Six Sigma Dan 5w+1h Sebagai Upaya Peningkatan Kualitas Produk,Iman Nuvi Alfian Budi Utomo,"Sugeng Purwoko,ST.,MT","Fitri Agustina,ST.,MT","Permasalahan kualitas bukan hanya sesuatu yang harus dipenuhi oleh suatu perusahaan, tapi telah menjadi suatu strategi untuk bersaing dalam menarik konsumen.  PT. Tirta Mahakam  Resources  tbk Gresik mempunyai pasar utama di luar negeri  (ekspor)  sebanyak (90%), sedangkan sisanya 10% adalah pasar dalam negeri.  Tentunya kualitas menjadi prioritas dalam proses produksinya. Tujuan dari penelitian ini adalah upaya peningkatan kualitas dengan pendekatan metode  Six Sigma,  Fault Tree Analysis  dan 5W+1H.  Six Sigma digunakan untuk mencari kapabilitas sigma pada proses produksi, Fault Tree Analysis digunakan untuk mencari akar penyebab masalah, sedangkan 5W+1H digunakan untuk memberikan usulan perbaikan pada proses produksi untuk peningkatan kualitas produk. Hasil dari penelitian ini diperoleh cacat yang terjadi adalah cacat permukaan kurang halus, cacat perubahan corak, cacat lebar veener, cacat terdapat pin hole, cacat terdapat mata kayu. Level sigma yang didapatkan nilai rata-rata DPMO dari empat periode sebesar 6.845 dengan level sigma 2.71. Target kinerja sigma adalah 2.73 dengan prosentase peningkatan sebesar 0.738%. untuk usulan perbaikannya adalah membuat display jadwal pemeriksaan dan penggantian pisau potong. Membuat ukuran setingan log yang pas. membuat ukuran setingan mesin yang pas. Memilih log yang akan direbus sehingga ketika log dipotong tidak keras. Memberikan  headset  pada operator mesin. Memberikan masker pada operator mesin. memberikan fentilasi udara yang cukup","Six Sigma, Fault Tree Analysis, 5W+1H",CAI
PENERAPAN METODE RADIAL BASIS FUNCTION NETWORK DENGAN K-MEANS CLUSTER UNTUK PERAMALAN KEBUTUHAN STRAW,Dwi Nuzulul Heriyanto,"Fika Hastarita Rachman, S.T, M.Eng","Budi Dwi Satoto, ST, M.Kom","Berawal dari permintaan akan Straw (sperma beku) sapi yang tinggi untuk menghasilkan bibit unggul. Bidang Peternakan Dinas Kelautan, Perikanan dan Peternakan (DKPP) Sampang masih belum dapat menentukan berapa banyaknya Straw yang dibutuhkan pada saat permintaan itu datang. Sering terjadi stok Straw yang tersedia kurang memenuhi permintaan para peternak sapi, atau malah sebaliknya persediaan Straw yang ada masih banyak. Data yang digunakan adalah data penggunaan Straw di Kabupaten Sampang bulan Januari 2008 sampai Desember 2011. Peramalan kebutuhan Straw merupakan proses untuk memperkirakan jumlah kebutuhan Straw di masa datang. Metode peramalan yang digunakan dalam sistem ini adalah metode Radial Basis Function Network (RBFN) dengan penentuan hidden node menggunakan K-Means Cluster. Metode K-Means digunakan karena ketepatan penentuan nilai centroid yang akurat, mudah dan penentuannya awalnya secara random. Sedangkan dalam penentuan nilai error menggunakan MAPE (Mean Absolute Percentage Error) dan MSE (Mean Square Error). Dalam uji coba sistem diketahui bahwa sistem mampu memprediksi kebutuhan Straw satu bulan kedepan. Dari evaluasi kinerja sistem diketahui bahwa nilai MAPE dan MSE terkecil diperoleh pada jumlah cluster=3 yang mempunyai Nilai MAPE 10.12%  dan MSE 0.0081.""",-,RPL
aplikasi media pembelajaran kamera DSLR (Digital Single Lens Reflex) berbasis multimedia,mochamad ali muwaffa,"Aeri Rachmad,S.T.,M.E.Eng.",-,"Perkembangan teknologi komputer yang semakin pesat menuntut pula penggunaannya dalam berbagai hal. Salah satunya adalah dalam bidang komunikasi visual, komputer banyak sekali berperan penting di dalamnya. Berbagai aplikasi komunikasi visual yang mendukung untuk tersampaikannya kepada manusia sudah semakin berkembang. Mulai dari software untuk mengoperasikan kamera bahkan hingga sarana untuk mempelajari kamera pun telah tersedia. Salah satu faktor yang menuntut saya mengambil judul ini adalah karena tidak begitu banyak media pembelajaran yang lebih dalam mencakup masalah shutter speed (kecepatan), ISO, serta aperture (diafragma) dalam kamera DSLR (Digital Single Lens Reflex).pada dasarnya pengenalan menu yang terdapat di beberapa media pembelajaran kamera hanya mengenalkan menu – menu pokok yang terdapat dalam kamera tersebut tanpa menjelaskan 3 poin pokok paling mendasar pada semua kamera yang wajib dipahami (shutter speed, ISO ,aperture). dapat mempengaruhi keberhasilan proses pembelajaran adalah dengan menggunakan media yang tepat. Materi pembelajaran disajikan berdasarkan topik yang dilengkapi dengan berbagai fitur multimedia yang dibangun dalam sebuah aplikasi yang dapat memberikan pembelajaran dasar mengenai cara menggunakan kamera, dari langkah pengoperasian manual pada kamera sehingga user yang masih pemula dapat mempelajari cara menggunakan kamera DSLR melalui komputer di rumah sebagai alternatif lain belajar kamera selain masuk ke sekolah fotografi.","Kamera, Media pembelajaran, Multimedia",RPL
